{
    "commands_file": "commands.txt",
    "excel_output_filename": "fare_report_{date}.xlsx",
    "rbd_sort_order": ["F", "A", "J", "C", "D", "I", "Z", "Y", "B", "M", "H", "K", "Q", "T", "N", "R", "V", "X", "L", "U", "E", "G", "S", "W", "O"],
    "domestic_airports": ["DAC", "CGP", "ZYL", "CXB"],
    "airline_names": {
        "BG": "Biman Bangladesh",
        "BS": "US-Bangla",
        "UL": "SriLankan",
        "8D": "Fits Air",
        "CZ": "China Southern",
        "QR": "Qatar Airways",
        "GF": "Gulf Air",
        "WY": "Oman Air",
        "OV": "SalamAir"
    },
    "city_names": {
        "DAC": "Dhaka",
        "MLE": "Male",
        "CAN": "Guangzhou",
        "MCT": "Muscat",
        "DOH": "Doha",
        "CGP": "Chittagong",
        "ZYL": "Sylhet",
        "CXB": "Cox's Bazar"
    },
    "tax_airports": {
        "SIN": {"country": "SG", "name": "Singapore"},
        "MLE": {"country": "MV", "name": "Maldives"},
        "CAN": {"country": "CN", "name": "China"},
        "KUL": {"country": "MY", "name": "Malaysia"}
    }
}
